,level_0,level_1,Name_x,Exact,Score,Name_y,Attributes,Category_x,Effect_x,Name,Category_y,Effect_y,sprite_url
516,1190,602,1.0,1,2.0,Serious Mint,[],Nature Mints,,Serious Mint,Battle items,Changes the Pokémon's stats to match a neutral nature.,https://img.pokemondb.net/s.png
517,1191,603,1.0,1,2.0,Shaderoot Carrot,[],Plot Advancement,,Shaderoot Carrot,General items,Produce that the King of Bountiful Harvests’ beloved steed likes to eat. It grew in a gloomy field.,https://img.pokemondb.net/s.png
518,1193,604,1.0,1,2.0,Shalour Sable,[],Status Cures,Cures any major status ailment and confusion.,Shalour Sable,Medicine,Heals all major status conditions.,https://img.pokemondb.net/sprites/items/shalour-sable.png
519,1194,605,1.0,1,2.0,Sharp Beak,"['holdable', 'holdable-active']",Type Enhancement,Held: Flying-Type moves from holder do 20% more damage.,Sharp Beak,Hold items,Increases the power of Flying-type moves.,https://img.pokemondb.net/sprites/items/sharp-beak.png
520,1195,606,1.0,1,2.0,Sharpedonite,[],Mega Stones,Held: Allows Sharpedo to Mega Evolve into Mega Sharpedo.,Sharpedonite,Hold items,Enables Sharpedo to Mega Evolve during battle.,https://img.pokemondb.net/sprites/items/sharpedonite.png
521,1196,607,1.0,1,2.0,Shed Shell,"['holdable', 'holdable-active']",Held Items,Held: Holder can bypass all trapping effects and switch out. Multi-turn moves still cannot be switched out of.,Shed Shell,Hold items,"A tough, discarded carapace to be held by a Pokémon. It enables the holder to switch with a waiting Pokémon in battle.",https://img.pokemondb.net/sprites/items/shed-shell.png
522,1197,608,1.0,1,2.0,Shell Bell,"['holdable', 'holdable-active']",Held Items,Held: Holder receives 1/8 of the damage it deals when attacking.,Shell Bell,Hold items,An item to be held by a Pokémon. The holder's HP is restored a little every time it inflicts damage.,https://img.pokemondb.net/sprites/items/shell-bell.png
523,1199,609,1.0,1,2.0,Shiny Charm,[],Gameplay,Raises the chance of finding a shiny Pokémon.,Shiny Charm,General items,A shiny charm said to increase the chance of finding a Shiny Pokémon in the wild.,https://img.pokemondb.net/sprites/items/shiny-charm.png
524,1200,610,1.0,1,2.0,Shiny Stone,[],Evolution,"Evolves a Minccino into Cinccino, a Roselia into Roserade, or a Togetic into Togekiss.",Shiny Stone,General items,Evolves certain species of Pokémon.,https://img.pokemondb.net/sprites/items/shiny-stone.png
525,1201,611,1.0,1,2.0,Shoal Salt,['countable'],Collectibles,No effect. Gen III: Trade four and four Shoal Shells for a Shell Bell.,Shoal Salt,General items,Pure salt that can be discovered deep inside the Shoal Cave. A maniac will buy it for a high price.,https://img.pokemondb.net/sprites/items/shoal-salt.png
526,1202,612,1.0,1,2.0,Shoal Shell,['countable'],Collectibles,No effect. Gen III: Trade four and four Shoal Salts for a Shell Bell.,Shoal Shell,General items,A pretty seashell that can be found deep inside the Shoal Cave. A maniac will buy it for a high price.,https://img.pokemondb.net/sprites/items/shoal-shell.png
527,1203,613,1.0,1,2.0,Shock Drive,[],Species Specific,"Grants Genesect a yellow, Electric-type Techno Blast.",Shock Drive,Hold items,Changes Techno Blast to an Electric-type move when held by Genesect.,https://img.pokemondb.net/sprites/items/shock-drive.png
528,1204,614,1.0,1,2.0,Shuca Berry,['holdable-active'],Type Protection,Held: Consumed when struck by a super-effective Ground-type attack to halve the damage.,Shuca Berry,Berries,Weakens a supereffective Ground-type attack against the holding Pokémon.,https://img.pokemondb.net/sprites/items/shuca-berry.png
529,1205,615,1.0,1,2.0,Silk Scarf,"['holdable', 'holdable-active']",Type Enhancement,Held: Normal-Type moves from holder do 20% more damage.,Silk Scarf,Hold items,Increases the power of Normal-type moves.,https://img.pokemondb.net/sprites/items/silk-scarf.png
530,1207,616,1.0,1,2.0,Silver Leaf,[],Loot,,Silver Leaf,General items,,https://img.pokemondb.net/s.png
531,1208,617,1.0,1,2.0,Silver Nanab Berry,[],Catching Bonus,,Silver Nanab Berry,Berries,"Greatly calms a Pokémon in battle, in Let's Go Pikachu/Eevee.",https://img.pokemondb.net/sprites/items/silver-nanab-berry.png
532,1209,618,1.0,1,2.0,Silver Pinap Berry,[],Catching Bonus,,Silver Pinap Berry,Berries,"Greatly increases chance of getting items when a Pokémon is caught, in Pokémon Let's Go.",https://img.pokemondb.net/sprites/items/silver-pinap-berry.png
533,1210,619,1.0,1,2.0,Silver Powder,"['holdable', 'holdable-active']",Type Enhancement,Held: Bug-Type moves from holder do 20% more damage.,Silver Powder,Hold items,Increases the power of Bug-type moves.,https://img.pokemondb.net/sprites/items/silver-powder.png
534,1211,620,1.0,1,2.0,Silver Razz Berry,[],Catching Bonus,,Silver Razz Berry,Berries,Makes a Pokémon easier to catch in Pokémon Let's Go.,https://img.pokemondb.net/sprites/items/silver-razz-berry.png
535,1213,621,1.0,1,2.0,Sitrus Berry,['holdable-active'],Medicine,Held: Consumed at 1/2 max HP to recover 1/4 max HP.,Sitrus Berry,Berries,"If held by a Pokémon, it heals the user's HP a little.",https://img.pokemondb.net/sprites/items/sitrus-berry.png
536,1214,622,1.0,1,2.0,Skull Fossil,['underground'],Dex Completion,Can be revived into a Cranidos.,Skull Fossil,General items,A fossil from a prehistoric Pokémon that lived on the land. It appears to be part of a head.,https://img.pokemondb.net/sprites/items/skull-fossil.png
537,1215,623,1.0,1,2.0,Sky Plate,"['holdable', 'holdable-active', 'underground']",Plates,Held: Flying-Type moves from holder do 20% more damage. Changes Arceus's and Judgment's type to Flying.,Sky Plate,Hold items,Increases power of Flying-type moves. Changes Arceus' type to Flying.,https://img.pokemondb.net/sprites/items/sky-plate.png
538,1216,625,1.0,1,2.0,Slowbronite,[],Mega Stones,Held: Allows Slowbro to Mega Evolve into Mega Slowbro.,Slowbronite,Hold items,Enables Slowbro to Mega Evolve during battle.,https://img.pokemondb.net/sprites/items/slowbronite.png
539,1219,626,1.0,1,2.0,Small Bouquet,[],Loot,,Small Bouquet,General items,,https://img.pokemondb.net/s.png
540,1220,627,1.0,1,2.0,Smart Candy,[],Vitamins,,Smart Candy,Medicine,Increases a Pokémon's Special Attack stat by 1.,https://img.pokemondb.net/sprites/items/smart-candy.png
541,1221,628,1.0,1,2.0,Smart Candy L,[],Vitamins,,Smart Candy L,Medicine,Increases a Pokémon's Special Attack stat.,https://img.pokemondb.net/sprites/items/smart-candy-l.png
542,1222,629,1.0,1,2.0,Smart Candy Xl,[],Vitamins,,Smart Candy Xl,Medicine,Increases a Pokémon's Special Attack stat.,https://img.pokemondb.net/sprites/items/smart-candy-xl.png
543,1223,630,1.0,1,2.0,Smoke Ball,"['holdable', 'holdable-active']",Held Items,Held: Allows the Holder to escape from any wild battle.,Smoke Ball,Hold items,An item to be held by a Pokémon. It enables the holder to flee from any wild Pokémon without fail.,https://img.pokemondb.net/sprites/items/smoke-ball.png
544,1224,632,1.0,1,2.0,Smoke Poke Tail,[],Curry Ingredients,,Smoke Poke Tail,General items,"One of the many ingredients that can be used for cooking at your camp. When a Slowpoke’s tail falls off, it grows back quickly.",https://img.pokemondb.net/s.png
545,1225,633,1.0,1,2.0,Smooth Rock,"['holdable', 'holdable-active', 'underground']",Held Items,Held: Sandstorm by the holder lasts 8 rounds instead of 5.,Smooth Rock,Hold items,A Pokémon held item that extends the duration of the move Sandstorm used by the holder.,https://img.pokemondb.net/sprites/items/smooth-rock.png
546,1230,635,1.0,1,2.0,Snowball,[],Held Items,"Held: If the holder is hit by a damaging Ice move, raises its Attack by one stage.",Snowball,Hold items,Raises Attack if hit by an Ice-type move.,https://img.pokemondb.net/sprites/items/snowball.png
547,1231,636,1.0,1,2.0,Soda Pop,"['countable', 'consumable', 'usable-overworld', 'usable-in-battle', 'holdable']",Healing,Restores 60 HP.,Soda Pop,Medicine,Restores 50 HP.,https://img.pokemondb.net/sprites/items/soda-pop.png
548,1232,637,1.0,1,2.0,Soft Sand,"['holdable', 'holdable-active']",Type Enhancement,Held: Ground-Type moves from holder do 20% more damage.,Soft Sand,Hold items,Increases the power of Ground-type moves.,https://img.pokemondb.net/sprites/items/soft-sand.png
549,1237,640,1.0,1,2.0,Soothe Bell,"['holdable', 'holdable-active']",Training,Held: Doubles the happiness earned by the holder.,Soothe Bell,Hold items,An item to be held by a Pokémon. It is a bell with a comforting chime that calms the holder and makes it friendly.,https://img.pokemondb.net/sprites/items/soothe-bell.png
550,1238,641,1.0,1,2.0,Soul Dew,['holdable'],Species Specific,Raises Latias and Latios's Special Attack and Special Defense by 50%.,Soul Dew,Hold items,Increases the power of Psychic- and Dragon-type moves when held by Latios or Latias. Increases Sp.Atk/Sp.Def prior to Gen 7.,https://img.pokemondb.net/sprites/items/soul-dew.png
551,1242,642,1.0,1,2.0,Spell Tag,"['holdable', 'holdable-active']",Type Enhancement,Held: Ghost-Type moves from holder do 20% more damage.,Spell Tag,Hold items,Increases the power of Ghost-type moves.,https://img.pokemondb.net/sprites/items/spell-tag.png
552,1243,643,1.0,1,2.0,Spelon Berry,[],Baking Only,Used for creating PokéBlocks and Poffins.,Spelon Berry,Berries,A Berry which is very rare in the Unova region. A maniac will buy it for a high price.,https://img.pokemondb.net/sprites/items/spelon-berry.png
553,1244,644,1.0,1,2.0,Spice Mix,[],Curry Ingredients,,Spice Mix,General items,One of the many ingredients that can be used for cooking at your camp. There are over fifty spices contained within this ingredient’s hot flavor.,https://img.pokemondb.net/s.png
554,1245,645,1.0,1,2.0,Splash Plate,"['holdable', 'holdable-active', 'underground']",Plates,Held: Water-Type moves from holder do 20% more damage. Changes Arceus's and Judgment's type to Water.,Splash Plate,Hold items,Increases power of Water-type moves. Changes Arceus' type to Water.,https://img.pokemondb.net/sprites/items/splash-plate.png
555,1246,647,1.0,1,2.0,Spooky Plate,"['holdable', 'holdable-active', 'underground']",Plates,Held: Ghost-Type moves from holder do 20% more damage. Changes Arceus's and Judgment's type to Ghost.,Spooky Plate,Hold items,Increases power of Ghost-type moves. Changes Arceus' type to Ghost.,https://img.pokemondb.net/sprites/items/spooky-plate.png
556,1247,648,1.0,1,2.0,Sport Ball,[],Standard Balls,Tries to catch a Pokémon in the Bug-Catching contest in National Park. (Gen II: Park Ball),Sport Ball,Pokeballs,A special Poké Ball for the Bug-Catching Contest.,https://img.pokemondb.net/sprites/items/sport-ball.png
557,1249,650,1.0,1,2.0,Sprinklotad,[],Gameplay,Waters Berry plants.,Sprinklotad,General items,"A watering can shaped like a Lotad. It helps promote the healthy growth of any Berries planted in good, soft soil.",https://img.pokemondb.net/sprites/items/sprinklotad.png
558,1255,651,1.0,1,2.0,Stable Mulch,[],Mulch,Berries stay on the plant for longer than their usual time.,Stable Mulch,General items,A fertilizer to be spread on soft soil in regions where Berries are grown. A maniac will buy it for a high price.,https://img.pokemondb.net/sprites/items/stable-mulch.png
559,1256,652,1.0,1,2.0,Star Piece,['underground'],Loot,"Platinum: Trade for one of each color Shard. Black and White: Trade for PP Up. Sell for 4900 Pokédollars, or to Ore Collector for 9800 Pokédollars.",Star Piece,General items,A shard of a pretty gem that sparkles in a red color. It can be sold at a high price to shops.,https://img.pokemondb.net/sprites/items/star-piece.png
560,1257,653,1.0,1,2.0,Star Sweet,[],Evolution,,Star Sweet,Hold items,Evolves Milcery into Star Flavor Alcremie.,https://img.pokemondb.net/s.png
561,1258,654,1.0,1,2.0,Stardust,[],Loot,"Sell for 1000 Pokédollars, or to Ore Collector for 2000 Pokédollars.",Stardust,General items,"Lovely, red-colored sand with a loose, silky feel. It can be sold at a high price to shops.",https://img.pokemondb.net/sprites/items/stardust.png
562,1259,655,1.0,1,2.0,Starf Berry,['holdable-active'],In A Pinch,Held: Consumed at 1/4 max HP to boost a random stat by two stages.,Starf Berry,Berries,Sharply raises a random stat when HP is low.,https://img.pokemondb.net/sprites/items/starf-berry.png
563,1261,657,1.0,1,2.0,Steel Gem,[],Jewels,"Held: When the holder uses a damaging steel-type move, the move has 1.5× power and this item is consumed.",Steel Gem,Hold items,Increases the power of a Steel-type move only once.,https://img.pokemondb.net/sprites/items/steel-gem.png
564,1263,658,1.0,1,2.0,Steel Memory,[],Memories,Held: Changes Silvally to its Steel form.  Changes Multi-Attack's type to Steel.,Steel Memory,Hold items,Changes Silvally and its move Multi-Attack to Steel type.,https://img.pokemondb.net/sprites/items/steel-memory.png
565,1266,660,1.0,1,2.0,Steelixite,[],Mega Stones,Held: Allows Steelix to Mega Evolve into Mega Steelix.,Steelixite,Hold items,Enables Steelix to Mega Evolve during battle.,https://img.pokemondb.net/sprites/items/steelixite.png
566,1268,661,1.0,1,2.0,Sticky Barb,"['holdable', 'holdable-active']",Bad Held Items,"Held: Holder takes 1/8 (12.5%) its max HP at the end of each turn. When the holder is hit by a contact move, the attacking Pokémon takes 1/8 its max HP in damage and receive the item if not holding one.",Sticky Barb,Hold items,A held item that damages the holder on every turn. It may latch on to foes and allies that touch the holder.,https://img.pokemondb.net/sprites/items/sticky-barb.png
567,1269,663,1.0,1,2.0,Stone Plate,"['holdable', 'holdable-active', 'underground']",Plates,Held: Rock-Type moves from holder do 20% more damage. Changes Arceus's and Judgment's type to Rock.,Stone Plate,Hold items,Increases power of Rock-type moves. Changes Arceus' type to Rock.,https://img.pokemondb.net/sprites/items/stone-plate.png
568,1273,665,1.0,1,2.0,Strange Souvenir,[],Loot,Vendor trash.,Strange Souvenir,General items,An ornament depicting a Pokémon that is venerated as a protector in some region far from Kalos.,https://img.pokemondb.net/sprites/items/strange-souvenir.png
569,1274,666,1.0,1,2.0,Strawberry Sweet,[],Evolution,,Strawberry Sweet,Hold items,Evolves Milcery into Strawberry Flavor Alcremie.,https://img.pokemondb.net/s.png
570,1275,667,1.0,1,2.0,Stretchy Spring,[],Loot,,Stretchy Spring,General items,,https://img.pokemondb.net/s.png
571,1279,668,1.0,1,2.0,Sun Stone,['underground'],Evolution,"Evolves a Cottonee into Whimsicott, a Gloom into Bellossom, a Petilil into Lilligant, or a Sunkern into Sunflora.",Sun Stone,General items,Evolves certain species of Pokémon.,https://img.pokemondb.net/sprites/items/sun-stone.png
572,1280,669,1.0,1,2.0,Super Lure,[],Spelunking,,Super Lure,General items,Attracts Pokémon in the wild.,https://img.pokemondb.net/s.png
573,1281,670,1.0,1,2.0,Super Potion,"['countable', 'consumable', 'usable-overworld', 'usable-in-battle', 'holdable']",Healing,Restores 50 HP.,Super Potion,Medicine,Restores 60 HP.,https://img.pokemondb.net/sprites/items/super-potion.png
574,1282,671,1.0,1,2.0,Super Repel,[],Spelunking,"For 200 steps, prevents wild encounters of level lower than your party's lead Pokémon.",Super Repel,General items,An item that prevents weak wild Pokémon from appearing for 200 steps after its use.,https://img.pokemondb.net/sprites/items/super-repel.png
575,1286,672,1.0,1,2.0,Swampertite,[],Mega Stones,Held: Allows Swampert to Mega Evolve into Mega Swampert.,Swampertite,Hold items,Enables Swampert to Mega Evolve during battle.,https://img.pokemondb.net/sprites/items/swampertite.png
576,1287,674,1.0,1,2.0,Sweet Apple,[],Evolution,,Sweet Apple,Hold items,Evolves Applin into Appletun.,https://img.pokemondb.net/s.png
577,1288,675,1.0,1,2.0,Sweet Heart,[],Healing,Restores 20 HP.,Sweet Heart,Medicine,Very sweet chocolate. It restores the HP of one Pokémon by only 20 points.,https://img.pokemondb.net/sprites/items/sweet-heart.png
578,1289,676,1.0,1,2.0,Swift Wing,[],Vitamins,Increases Speed effort by 1.,Swift Wing,Medicine,Increases Speed EVs by 1.,https://img.pokemondb.net/sprites/items/swift-wing.png
579,1290,678,1.0,1,2.0,Tamato Berry,[],Effort Drop,Drops Speed Effort Values by 10 and raises happiness.,Tamato Berry,Berries,Increases Friendship but lowers Speed EVs.,https://img.pokemondb.net/sprites/items/tamato-berry.png
580,1291,679,1.0,1,2.0,Tanga Berry,['holdable-active'],Type Protection,Held: Consumed when struck by a super-effective Bug-type attack to halve the damage.,Tanga Berry,Berries,Weakens a supereffective Bug-type attack against the holding Pokémon.,https://img.pokemondb.net/sprites/items/tanga-berry.png
581,1295,681,1.0,1,2.0,Tart Apple,[],Evolution,,Tart Apple,Hold items,Evolves Applin into Flapple.,https://img.pokemondb.net/s.png
582,1300,682,1.0,1,2.0,Terrain Extender,[],Held Items,Held: Extends the holder's Terrain effects to 8 turns.,Terrain Extender,Hold items,An item to be held by a Pokémon. It extends the duration of the terrain caused by the holder's move or Ability.,https://img.pokemondb.net/sprites/items/terrain-extender.png
583,1302,683,1.0,1,2.0,Thick Club,['holdable'],Species Specific,Doubles Cubone or Marowak's Attack.,Thick Club,Hold items,Increases Attack when held by Cubone or Marowak.,https://img.pokemondb.net/sprites/items/thick-club.png
584,1303,684,1.0,1,2.0,Throat Spray,[],Held Items,,Throat Spray,Hold items,Raises Sp. Atk when a sound-based move is used.,https://img.pokemondb.net/s.png
585,1304,685,1.0,1,2.0,Thunder Stone,['underground'],Evolution,"Evolves an Eelektrik into Eelektross, an Eevee into Jolteon, or a Pikachu into Raichu.",Thunder Stone,General items,Evolves certain species of Pokémon.,https://img.pokemondb.net/sprites/items/thunder-stone.png
586,1306,686,1.0,1,2.0,Timer Ball,"['countable', 'consumable', 'usable-in-battle', 'holdable']",Special Balls,"Tries to catch a wild Pokémon. Success rate increases by 0.1× (Gen V: 0.3×) every turn, to a max of 4×.",Timer Ball,Pokeballs,A somewhat different BALL that becomes progressively better the more turns there are in a battle.,https://img.pokemondb.net/sprites/items/timer-ball.png
587,1307,687,1.0,1,2.0,Timid Mint,[],Nature Mints,,Timid Mint,Battle items,Changes the Pokémon's stats to match the Timid nature.,https://img.pokemondb.net/s.png
588,1308,688,1.0,1,2.0,Tin Of Beans,[],Curry Ingredients,,Tin Of Beans,General items,"One of the many ingredients that can be used for cooking at your camp. When simmered, the beans suffuse a dish with their mild flavor.",https://img.pokemondb.net/s.png
589,1309,689,1.0,1,2.0,Tiny Mushroom,[],Loot,"Fire Red and Leaf Green: Trade two for prior Level-up moves. Sell for 250 Pokédollars, or to Hungry Maid for 500 Pokédollars.",Tiny Mushroom,General items,A small and rare mushroom. It is sought after by collectors.,https://img.pokemondb.net/sprites/items/tiny-mushroom.png
590,1311,690,1.0,1,2.0,Tm00,[],All Machines,,Tm00,Machines,Teaches the move Mega Punch.,https://img.pokemondb.net/s.png
591,1312,691,1.0,1,2.0,Tm01,[],All Machines,Teaches Hone Claws to a compatible Pokémon. (Gen IV & III: Focus Punch Gen II: DynamicPunch Gen I: Mega Punch),Tm01,Machines,Teaches the move Mega Punch/Dynamic Punch/Focus Punch/Hone Claws/Work Up/Headbutt/Mega Kick.,https://img.pokemondb.net/sprites/items/tm-normal.png
592,1313,692,1.0,1,2.0,Tm02,[],All Machines,Teaches Dragon Claw to a compatible Pokémon. (Gen II: Headbutt Gen I: Razor Wind),Tm02,Machines,Teaches the move Razor Wind/Headbutt/Dragon Claw/Taunt/Pay Day.,https://img.pokemondb.net/sprites/items/tm-dragon.png
593,1314,693,1.0,1,2.0,Tm03,[],All Machines,Teaches Psyshock to a compatible Pokémon. (Gen IV & III: Water Pulse Gen II: Curse Gen I: Swords Dance),Tm03,Machines,Teaches the move Swords Dance/Curse/Water Pulse/Psyshock/Helping Hand/Fire Punch.,https://img.pokemondb.net/sprites/items/tm-psychic.png
594,1315,694,1.0,1,2.0,Tm04,[],All Machines,Teaches Calm Mind to a compatible Pokémon. (Gen II: Rollout Gen I: Whirlwind),Tm04,Machines,Teaches the move Whirlwind/Rollout/Calm Mind/Teleport/Ice Punch.,https://img.pokemondb.net/sprites/items/tm-psychic.png
595,1316,695,1.0,1,2.0,Tm05,[],All Machines,Teaches Roar to a compatible Pokémon. (Gen I: Mega Kick),Tm05,Machines,Teaches the move Mega Kick/Roar/Rest/Thunder Punch.,https://img.pokemondb.net/sprites/items/tm-normal.png
596,1317,696,1.0,1,2.0,Tm06,[],All Machines,Teaches Toxic to a compatible Pokémon.,Tm06,Machines,Teaches the move Toxic/Light Screen/Fly.,https://img.pokemondb.net/sprites/items/tm-poison.png
597,1318,697,1.0,1,2.0,Tm07,[],All Machines,Teaches Hail to a compatible Pokémon. (Gen II: Zap Cannon Gen I: Horn Drill),Tm07,Machines,Teaches the move Horn Drill/Zap Cannon/Hail/Protect/Pin Missile.,https://img.pokemondb.net/sprites/items/tm-ice.png
598,1319,698,1.0,1,2.0,Tm08,[],All Machines,Teaches Bulk Up to a compatible Pokémon. (Gen II: Rock Smash Gen I: Body Slam),Tm08,Machines,Teaches the move Body Slam/Rock Smash/Bulk Up/Substitute/Hyper Beam.,https://img.pokemondb.net/sprites/items/tm-fighting.png
599,1320,699,1.0,1,2.0,Tm09,[],All Machines,Teaches Venoshock to a compatible Pokémon. (Gen IV & III: Bullet Seed Gen II: Psych Up Gen I: Take Down),Tm09,Machines,Teaches the move Take Down/Psych Up/Bullet Seed/Venoshock/Reflect/Giga Impact.,https://img.pokemondb.net/sprites/items/tm-poison.png
600,1321,700,1.0,1,2.0,Tm10,[],All Machines,Teaches Hidden Power to a compatible Pokémon. (Gen I: Double-Edge),Tm10,Machines,Teaches the move Double-Edge/Hidden Power/Dig/Magical Leaf/Work Up.,https://img.pokemondb.net/sprites/items/tm-normal.png
601,1322,701,1.0,1,2.0,Tm100,[],All Machines,Teaches a Pokémon TM100.,Tm100,Machines,Teaches the move Confide/Rock Climb.,https://img.pokemondb.net/sprites/items/tm-normal.png
602,1323,702,1.0,1,2.0,Tm11,[],All Machines,Teaches Sunny Day to a compatible Pokémon. (Gen I: BubbleBeam),Tm11,Machines,Teaches the move BubbleBeam/Sunny Day/Will-O-Wisp/Solar Beam.,https://img.pokemondb.net/sprites/items/tm-fire.png
603,1324,703,1.0,1,2.0,Tm12,[],All Machines,Teaches Taunt to a compatible Pokémon. (Gen II: Sweet Scent Gen I: Water Gun),Tm12,Machines,Teaches the move Water Gun/Sweet Scent/Taunt/Facade/Solar Blade.,https://img.pokemondb.net/sprites/items/tm-dark.png
604,1325,704,1.0,1,2.0,Tm13,[],All Machines,Teaches Ice Beam to a compatible Pokémon. (Gen II: Snore),Tm13,Machines,Teaches the move Ice Beam/Snore/Brick Break/Fire Spin.,https://img.pokemondb.net/sprites/items/tm-ice.png
605,1326,705,1.0,1,2.0,Tm14,[],All Machines,Teaches Blizzard to a compatible Pokémon.,Tm14,Machines,Teaches the move Blizzard/Fly/Thunder Wave.,https://img.pokemondb.net/sprites/items/tm-ice.png
606,1327,706,1.0,1,2.0,Tm15,[],All Machines,Teaches Hyper Beam to a compatible Pokémon.,Tm15,Machines,Teaches the move Hyper Beam/Seismic Toss/Dig.,https://img.pokemondb.net/sprites/items/tm-normal.png
607,1328,707,1.0,1,2.0,Tm16,[],All Machines,Teaches Light Screen to a compatible Pokémon. (Gen II: Icy Wind Gen I: Pay Day),Tm16,Machines,Teaches the move Pay Day/Icy Wind/Light Screen/Thunder Wave/Screech.,https://img.pokemondb.net/sprites/items/tm-psychic.png
608,1329,708,1.0,1,2.0,Tm17,[],All Machines,Teaches Protect to a compatible Pokémon. (Gen I: Submission),Tm17,Machines,Teaches the move Submission/Protect/Dragon Tail/Light Screen.,https://img.pokemondb.net/sprites/items/tm-normal.png
609,1330,709,1.0,1,2.0,Tm18,[],All Machines,Teaches Rain Dance to a compatible Pokémon. (Gen I: Counter),Tm18,Machines,Teaches the move Counter/Rain Dance/U-turn/Reflect.,https://img.pokemondb.net/sprites/items/tm-water.png
610,1331,710,1.0,1,2.0,Tm19,[],All Machines,Teaches Telekinesis to a compatible Pokémon. (Gen IV & III & II: Giga Drain Gen I: Seismic Toss),Tm19,Machines,Teaches the move Seismic Toss/Giga Drain/Telekinesis/Roost/Iron Tail/Safeguard.,https://img.pokemondb.net/sprites/items/tm-flying.png
611,1332,711,1.0,1,2.0,Tm20,[],All Machines,Teaches Safeguard to a compatible Pokémon. (Gen II: Endure Gen I: Rage),Tm20,Machines,Teaches the move Rage/Endure/Safeguard/Dark Pulse/Self-Destruct.,https://img.pokemondb.net/sprites/items/tm-normal.png
612,1333,712,1.0,1,2.0,Tm21,[],All Machines,Teaches Frustration to a compatible Pokémon. (Gen I: Mega Drain),Tm21,Machines,Teaches the move Mega Drain/Frustration/Foul Play/Rest/Dazzling Gleam.,https://img.pokemondb.net/sprites/items/tm-normal.png
613,1334,713,1.0,1,2.0,Tm22,[],All Machines,Teaches SolarBeam to a compatible Pokémon.,Tm22,Machines,Teaches the move SolarBeam/Rock Slide.,https://img.pokemondb.net/sprites/items/tm-grass.png
614,1335,714,1.0,1,2.0,Tm23,[],All Machines,Teaches Smack Down to a compatible Pokémon. (Gen IV & III & II: Iron Tail Gen I: Dragon Rage),Tm23,Machines,Teaches the move Dragon Rage/Iron Tail/Smack Down/Thunder Punch/Thief.,https://img.pokemondb.net/sprites/items/tm-rock.png
615,1336,715,1.0,1,2.0,Tm24,[],All Machines,Teaches Thunderbolt to a compatible Pokémon. (Gen II: DragonBreath),Tm24,Machines,Teaches the move Thunderbolt/DragonBreath/X-Scissor/Snore.,https://img.pokemondb.net/sprites/items/tm-electric.png
616,1337,716,1.0,1,2.0,Tm25,[],All Machines,Teaches Thunder to a compatible Pokémon.,Tm25,Machines,Teaches the move Thunder/Waterfall/Protect.,https://img.pokemondb.net/sprites/items/tm-electric.png
617,1338,717,1.0,1,2.0,Tm26,[],All Machines,Teaches Earthquake to a compatible Pokémon.,Tm26,Machines,Teaches the move Earthquake/Poison Jab/Scary Face.,https://img.pokemondb.net/sprites/items/tm-ground.png
618,1339,718,1.0,1,2.0,Tm27,[],All Machines,Teaches Return to a compatible Pokémon. (Gen I: Fissure),Tm27,Machines,Teaches the move Fissure/Return/Toxic/Icy Wind/Low Sweep.,https://img.pokemondb.net/sprites/items/tm-normal.png
619,1340,719,1.0,1,2.0,Tm28,[],All Machines,Teaches Dig to a compatible Pokémon.,Tm28,Machines,Teaches the move Dig/Leech Life/Tri Attack/Giga Drain.,https://img.pokemondb.net/sprites/items/tm-bug.png
